<?xml version="1.0" encoding="UTF-8"?>

<arac xmlns:xsi="http://www.w3.org/2001/XMLSchema-instance" xsi:noNamespaceSchemaLocation="aracschema.xsd">

  <force name="Force-CenterPoints" layoutOtrigin="2000,2000" nodeDistance="3200" iterations="120">
    <edgemappingset name="CenterPoints" />
  </force>
  <force name="Force-CenterPoints-Anim" layoutOtrigin="2000,2000" nodeDistance="2000" iterations="1">
    <edgemappingset name="CenterPoints" />
  </force>

  <flow name="Flow-CardinalPoints" layoutOrigin="2000,2000" nodeDistance="1000" layerDistance="1500" >
    <edgemappingset name="Flow-CardinalPoints" />
  </flow>
  <flow name="Flow-CardinalPoints-Orth" layoutOrigin="2000,2000" nodeDistance="1000" layerDistance="1500"
        edgeType="Orthogonal" >
    <edgemappingset name="Flow-CardinalPoints" />
  </flow>

  <flow name="Flow-TTB-N" layoutOrigin="2000,2000" layoutOrientation="TopToBottom" nodeDistance="1000" layerDistance="1500"
        edgeType="Orthogonal" >
    <edgemappingset name="Flow-CardinalPoints" />
  </flow>
  <flow name="Flow-BTT-N" layoutOrigin="2000,2000" layoutOrientation="BottomToTop" nodeDistance="1000" layerDistance="1500"
        edgeType="Orthogonal" >
    <edgemappingset name="Flow-CardinalPoints" />
  </flow>
  <flow name="Flow-LTR-N" layoutOrigin="2000,2000" layoutOrientation="LeftToRight" nodeDistance="1000" layerDistance="1500"
        edgeType="Orthogonal" >
    <edgemappingset name="Flow-CardinalPoints" />
  </flow>
  <flow name="Flow-RTL-N" layoutOrigin="2000,2000" layoutOrientation="RightToLeft" nodeDistance="1000" layerDistance="1500"
        edgeType="Orthogonal" >
    <edgemappingset name="Flow-CardinalPoints" />
  </flow>

  <flow name="Flow-TTB-LP" layoutOrigin="2000,2000" layoutOrientation="TopToBottom" nodeDistance="1000" layerDistance="1500" pathBalancing="LongestPath"
        edgeType="Orthogonal" >
    <edgemappingset name="Flow-CardinalPoints" />
  </flow>
  <flow name="Flow-BTT-LP" layoutOrigin="2000,2000" layoutOrientation="BottomToTop" nodeDistance="1000" layerDistance="1500" pathBalancing="LongestPath"
        edgeType="Orthogonal" >
    <edgemappingset name="Flow-CardinalPoints" />
  </flow>
  <flow name="Flow-LTR-LP" layoutOrigin="2000,2000" layoutOrientation="LeftToRight" nodeDistance="1000" layerDistance="1500" pathBalancing="LongestPath"
        edgeType="Orthogonal" >
    <edgemappingset name="Flow-CardinalPoints" />
  </flow>
  <flow name="Flow-RTL-LP" layoutOrigin="2000,2000" layoutOrientation="RightToLeft" nodeDistance="1000" layerDistance="1500" pathBalancing="LongestPath"
        edgeType="Orthogonal" >
    <edgemappingset name="Flow-CardinalPoints" />
  </flow>

  <tree name="Tree-Default" layoutOrigin="2000,2000" />
  <tree name="Tree-CardinalPoints" layoutOrigin="2000,2000" nodeDistance="500" layerDistance="1000" >
    <edgemappingset name="TreeN-CardinalPoints" />
    <edgemappingset name="TreeLS-CardinalPoints" />
    <edgemappingset name="TreeLD-CardinalPoints" />
    <edgemappingset name="TreeHV-CardinalPoints" />
  </tree>
  <tree name="Tree-CardinalPoints-Orth" layoutOrigin="2000,2000" nodeDistance="500" layerDistance="1000"
        edgeType="Orthogonal" >
    <edgemappingset name="TreeN-CardinalPoints" />
    <edgemappingset name="TreeLS-CardinalPoints" />
    <edgemappingset name="TreeLD-CardinalPoints" />
    <edgemappingset name="TreeHV-CardinalPoints" />
  </tree>

  <chain name="OrgChart-Demo" configs="OrgChart-Demo2,OrgChart-Demo1" />
  <tree name="OrgChart-Demo1" layoutOrigin="2000,2000" layoutOrientation="TopToBottom" treeStyle="TreeNormal" nodeDistance="500" layerDistance="1000"
        edgeType="Orthogonal" edgeTypeDesc="lineCorners:200" tags="orgmanager, orgperson" careAnnex="true" >
    <edgemappingset name="TreeN-CardinalPoints" />
	<!-- treelevel level="4" layoutOrientation="TopToBottom" treeStyle="TreeListSingle" nodeDistance="500" layerDistance="-1000"
               edgeType="Elbow" edgeTypeDesc="elbow:Target" tags="orgmanager, orgperson" >
      <edgemappingset name="TreeLS-CardinalPoints" />
	</treelevel -->
	<node tag="orgmanager" layoutOrientation="TopToBottom" treeStyle="TreeNormal" nodeDistance="500" layerDistance="1000"
          edgeType="Orthogonal" edgeTypeDesc="lineCorners:200" tags="orgmanager, orgperson" careAnnex="true" >
      <edgemappingset name="TreeN-CardinalPoints" />
	</node>
	<node tag="orgperson" layoutOrientation="TopToBottom" treeStyle="TreeListSingle" nodeDistance="500" layerDistance="-1000"
          edgeType="Elbow" edgeTypeDesc="elbow:Target; lineCorners:200" tags="orgperson, orgmanager" careAnnex="true" tagsNonAnnex="orgmanager" >
      <edgemappingset name="TreeLS-CardinalPoints" />
	</node>
  </tree>
  <tree name="OrgChart-Demo2" treeStyle="TreeNormal" layoutOrigin="2000,2000" layoutOrientation="TopToBottom" nodeDistance="500" layerDistance="-500"
        tags="orgmanager, orgperson, orgassistent" careAnnex="true" tagsNonAnnex="orgmanager, orgperson" >
    <edgemappingset name="TreeN-CardinalPoints" />
	<node tag="orgmanager" subsequent="false" layoutOrientation="TopToBottom" treeStyle="TreeListDouble" nodeDistance="500" layerDistance="-500"
          edgeType="Elbow" edgeTypeDesc="elbow:Target; lineCorners:200" tags="orgmanager, orgassistent" careAnnex="true" tagsNonAnnex="orgperson, orgmanager" >
      <edgemappingset name="TreeLD-CardinalPoints" />
	</node>
	<node tag="orgperson" subsequent="false" layoutOrientation="TopToBottom" treeStyle="TreeListDouble" nodeDistance="500" layerDistance="-500"
          edgeType="Elbow" edgeTypeDesc="elbow:Target; lineCorners:200" tags="orgperson, orgassistent" careAnnex="true" tagsNonAnnex="orgperson, orgmanager" >
      <edgemappingset name="TreeLD-CardinalPoints" />
	</node>
  </tree>
  <!-- tree name="OrgChart-Demo3" treeStyle="TreeNormal" layoutOrigin="2000,2000" layoutOrientation="TopToBottom" nodeDistance="1000" layerDistance="-500"
        tags="orgmanager, orgperson, orgservant" careAnnex="true" tagsNonAnnex="orgmanager, orgperson, orgassistent" >
    <edgemappingset name="TreeN-CardinalPoints" />
	<node tag="orgmanager" subsequent="false" layoutOrientation="RightToLeft" treeStyle="TreeListDouble" nodeDistance="1000" layerDistance="-500"
          edgeType="Elbow" edgeTypeDesc="elbow:Target; srcSlope:500" tags="orgmanager, orgservant" careAnnex="true" tagsNonAnnex="orgperson, orgassistent" >
      <edgemappingset name="TreeLD-CardinalPoints" />
	</node>
	<node tag="orgperson" subsequent="false" layoutOrientation="RightToLeft" treeStyle="TreeListDouble" nodeDistance="1000" layerDistance="-500"
          edgeType="Elbow" edgeTypeDesc="elbow:Target; srcSlope:500" tags="orgperson, orgservant" careAnnex="true" tagsNonAnnex="orgmanager, orgassistent" >
      <edgemappingset name="TreeLD-CardinalPoints" />
	</node>
  </tree -->

  <tree name="Tree-Lo.TB" layoutOrigin="2000,2000" layoutOrientation="TopToBottom" nodeDistance="500" layerDistance="1000" >
    <edgemappingset name="TreeN-CardinalPoints" />
  </tree>
  <tree name="Tree-Lo.BT" layoutOrigin="2000,2000" layoutOrientation="BottomToTop" nodeDistance="500" layerDistance="1000" >
    <edgemappingset name="TreeN-CardinalPoints" />
  </tree>
  <tree name="Tree-Lo.LR" layoutOrigin="2000,2000" layoutOrientation="LeftToRight" nodeDistance="500" layerDistance="1000" >
    <edgemappingset name="TreeN-CardinalPoints" />
  </tree>
  <tree name="Tree-Lo.RL" layoutOrigin="2000,2000" layoutOrientation="RightToLeft" nodeDistance="500" layerDistance="1000" >
    <edgemappingset name="TreeN-CardinalPoints" />
  </tree>

  <tree name="Tree-Lo.TB-Pb.H" layoutOrigin="2000,2000" layoutOrientation="TopToBottom" parentBalancing="Head" nodeDistance="500" layerDistance="1000" >
    <edgemappingset name="TreeN-CardinalPoints" />
  </tree>
  <tree name="Tree-Lo.BT-Pb.H" layoutOrigin="2000,2000" layoutOrientation="BottomToTop" parentBalancing="Head" nodeDistance="500" layerDistance="1000" >
    <edgemappingset name="TreeN-CardinalPoints" />
  </tree>
  <tree name="Tree-Lo.LR-Pb.H" layoutOrigin="2000,2000" layoutOrientation="LeftToRight" parentBalancing="Head" nodeDistance="500" layerDistance="1000" >
    <edgemappingset name="TreeN-CardinalPoints" />
  </tree>
  <tree name="Tree-Lo.RL-Pb.H" layoutOrigin="2000,2000" layoutOrientation="RightToLeft" parentBalancing="Head" nodeDistance="500" layerDistance="1000" >
    <edgemappingset name="TreeN-CardinalPoints" />
  </tree>

  <tree name="Tree-Lo.TB-Pb.T" layoutOrigin="2000,2000" layoutOrientation="TopToBottom" parentBalancing="Tail" nodeDistance="500" layerDistance="1000" >
    <edgemappingset name="TreeN-CardinalPoints" />
  </tree>
  <tree name="Tree-Lo.BT-Pb.T" layoutOrigin="2000,2000" layoutOrientation="BottomToTop" parentBalancing="Tail" nodeDistance="500" layerDistance="1000" >
    <edgemappingset name="TreeN-CardinalPoints" />
  </tree>
  <tree name="Tree-Lo.LR-Pb.T" layoutOrigin="2000,2000" layoutOrientation="LeftToRight" parentBalancing="Tail" nodeDistance="500" layerDistance="1000" >
    <edgemappingset name="TreeN-CardinalPoints" />
  </tree>
  <tree name="Tree-Lo.RL-Pb.T" layoutOrigin="2000,2000" layoutOrientation="RightToLeft" parentBalancing="Tail" nodeDistance="500" layerDistance="1000" >
    <edgemappingset name="TreeN-CardinalPoints" />
  </tree>

  <tree name="ListS-Lo.TB-Pb.HM" treeStyle="TreeListSingle" layoutOrigin="2000,2000" layoutOrientation="TopToBottom" nodeDistance="1000" layerDistance="0"
        edgeType="Elbow" edgeTypeDesc="elbow:Target" >
    <edgemappingset name="TreeLS-CardinalPoints" />
  </tree>
  <tree name="ListS-Lo.BT-Pb.HM" treeStyle="TreeListSingle" layoutOrigin="2000,2000" layoutOrientation="BottomToTop" nodeDistance="1000" layerDistance="0"
        edgeType="Elbow" edgeTypeDesc="elbow:Target" >
    <edgemappingset name="TreeLS-CardinalPoints" />
  </tree>
  <tree name="ListS-Lo.LR-Pb.HM" treeStyle="TreeListSingle" layoutOrigin="2000,2000" layoutOrientation="LeftToRight" nodeDistance="1000" layerDistance="0"